{
  "instanceId": "orbit-chip-cloud.defaults",
  "theme": {},
  "global": {
    "speed": 1,
    "delayOffset": 0,
    "easing": "ease-out-cubic"
  },
  "elements": [{ "id": "chip-0", "text": "PILLAR A" }],
  "extras": {
    "chips": [
      "PILLAR A",
      "PILLAR B",
      "PILLAR C",
      "PILLAR D"
    ],
    "eyebrow": null,
    "title": null,
    "subtitle": null,
    "chipsStaggerSeconds": 0.1,
    "revealSeconds": 0.95,
    "orbitStartAngleDeg": -90,
    "orbitDegreesPerSec": 8,
    "orbitRadiusXPx": 728,
    "orbitRadiusYPx": 388,
    "orbitStroke": null,
    "orbitStrokeWidthPx": 1,
    "orbitDashOnPx": 4,
    "orbitDashOffPx": 8,
    "orbitDashDriftPxPerSec": 6,
    "chipHeightPx": 56,
    "chipPaddingXPx": 32,
    "chipPaddingYPx": 14,
    "chipFill": null,
    "chipTextColor": null,
    "chipStroke": null,
    "chipStrokeWidthPx": 0,
    "chipRadiusPx": 28,
    "chipFontWeight": 600,
    "chipFontSizeScale": 0.42,
    "chipArrivalTangent": "behind",
    "chipArrivalOffsetPx": 110,
    "chipTextShadow": false,
    "nodeRadiusPx": 70,
    "nodeFill": null,
    "nodeGlow": true,
    "nodeLabel": "CORE",
    "nodeLabelColor": null,
    "nodeLabelFontPx": 24,
    "connectors": true,
    "connectorColor": null,
    "connectorWidthPx": 1,
    "connectorsDrawOn": true,
    "accentColor": null,
    "surfaceColor": null,
    "sceneBg": null,
    "holdAfterLandFrames": 18
  }
}
